<?xml version="1.0" encoding="UTF-8" standalone="no"?>
<vad:Definition xmlns:vad="http://www.vaplication.com/definition" xmlns:xsi="http://www.w3.org/2001/XMLSchema-instance"
    xsi:schemaLocation="http://www.vaplication.com/definition vapplication-definitons.xsd ">
    <vad:beans>
        <vad:bean id="seconBasicBeanTest" class="main.java.leiDina.tec.persister.Entity"/>

        <vad:bean id="secondBeanRefTest" class="main.java.leiDina.tec.persister.EntityOne">
            <vad:property propertyName="beanProperty">
                <vad:mapProperty keyType="class">
                    <vad:entry key="main.java.leiDina.tec.persister.EntityOne">
                        <vad:beanProperty ref="test"/>
                    </vad:entry>
                    <vad:entry key="main.java.leiDina.tec.persister.EntityOne">
                        <vad:beanProperty ref="teste"/>
                    </vad:entry>
                </vad:mapProperty>
            </vad:property>
        </vad:bean>
    </vad:beans>
</vad:Definition>